{
  "meta": {
    "title": "U13 · Parts · SISO templates",
    "description": "The twelve modules every family composes, rendered once each with the JSON they take.",
    "stream": "projects",
    "crumb": [
      {
        "label": "Templates",
        "href": "/"
      },
      {
        "label": "U13 · Parts",
        "href": "/t/U13/"
      },
      {
        "label": "fixture"
      }
    ],
    "actions": [
      {
        "label": "parts.css",
        "href": "/parts/parts.css",
        "icon": "file-code"
      },
      {
        "label": "parts/ on GitHub",
        "href": "https://github.com/sisodias/siso-shell/tree/main/parts",
        "icon": "git-branch",
        "external": true
      }
    ],
    "source": "parts/"
  },
  "heading": {
    "breadcrumb": [
      {
        "label": "Templates",
        "href": "/"
      },
      {
        "label": "U13",
        "href": "/t/U13/"
      },
      {
        "label": "fixture"
      }
    ],
    "kicker": "U13 <span class=\"sep\">·</span> reusable modules <span class=\"sep\">·</span> <span class=\"dim\">library-ui-spec §6</span>",
    "title": "The twelve parts, rendered once each",
    "subtitle": "Every family below composes these. One HTML partial each in <code>parts/</code>, one stylesheet, dark tokens, no framework. View source: each block on this page is one partial fed one JSON object, shown under it.",
    "badges": [
      {
        "label": "12 parts + 5 atoms",
        "tone": "now",
        "dot": true
      },
      {
        "label": "truthful empty states",
        "tone": "now"
      },
      {
        "label": "real 404",
        "tone": "now"
      },
      {
        "label": "Action Model presentation, receipts kept",
        "tone": "clients"
      }
    ],
    "status": {
      "kicker": "Where",
      "value": "siso-shell/parts/",
      "note": "Composed by <code>bin/compose</code> through <code>{{&gt; part data}}</code>.",
      "facts": [
        {
          "k": "css",
          "v": "<code>parts/parts.css</code>"
        },
        {
          "k": "js",
          "v": "<code>parts/catalogue.js</code> only"
        }
      ]
    }
  },
  "sections": {
    "why": {
      "n": "00",
      "title": "Why parts",
      "sub": "his words · the reading"
    },
    "index": {
      "n": "01",
      "title": "Index"
    },
    "states": {
      "n": "13",
      "title": "Empty, blocked, 404",
      "sub": "each part has a truthful empty state; the site has a real 404 (GAPS F-3)"
    }
  },
  "reasoning": {
    "source": [],
    "why": "Every family composes the same parts; build them once as partials or every page drifts (the atlas already has 24 hand-written pages). The Action Model pages are the proof that these parts render from real data.",
    "readers": "Human: consistent reading. Agent: consistent DOM to parse.",
    "questions": [
      "Which parts exist and what data does each take?"
    ],
    "claim_ceiling": "A part renders only what its JSON carries; empty means empty.",
    "data": "a fixture page with all parts + their JSON shapes.",
    "privacy": "—",
    "empty_state": "each part has a truthful empty state (and the site has a real 404, GAPS F-3).",
    "agent_entry": "parts/<name>.html · the JSON shape under each block here"
  },
  "index": {
    "items": [
      {
        "label": "01 · Global shell",
        "what": "the CRM GroupedRail: grouped navigation, search, collapse; the rail on this page",
        "href": "#shell",
        "state": "built",
        "tone": "now"
      },
      {
        "label": "02 · Heading",
        "what": "breadcrumb · kicker · title · purpose · state badges · status panel",
        "href": "#heading",
        "state": "built",
        "tone": "now"
      },
      {
        "label": "03 · Reasoning block",
        "what": "his words (source) vs the seat's reading, then the claim ceiling, data, privacy, empty state, agent entry",
        "href": "#reasoning",
        "state": "built",
        "tone": "now"
      },
      {
        "label": "04 · Map · typed relationship map + ecosystem loop",
        "what": "the mind map: repos, Works, questions, industries, people, nodes as a graph, with its text equivalent; and the loop",
        "href": "#map",
        "state": "built",
        "tone": "now"
      },
      {
        "label": "05 · Repository cards",
        "what": "every repo incl. private: head, time, branch, visibility, access, rights",
        "href": "#repos",
        "state": "built",
        "tone": "now"
      },
      {
        "label": "06 · Sauce cards",
        "what": "3–7 genuinely useful assets, examples, datasets or receipts",
        "href": "#sauce",
        "state": "built",
        "tone": "now"
      },
      {
        "label": "07 · Contents + procedure",
        "what": "capability list with states, and the ordered flow steps",
        "href": "#contents",
        "state": "built",
        "tone": "now"
      },
      {
        "label": "08 · Agent quick-start",
        "what": "entry file, actual commands, owner, verification line, machine context",
        "href": "#quickstart",
        "state": "built",
        "tone": "now"
      },
      {
        "label": "09 · Evidence / limits / version",
        "what": "facts with receipts vs proposals, visibly distinct; limits; version",
        "href": "#evidence",
        "state": "built",
        "tone": "now"
      },
      {
        "label": "10 · Activity strip",
        "what": "observation date and coverage, a density strip, the dated lines",
        "href": "#activity",
        "state": "built",
        "tone": "now"
      },
      {
        "label": "11 · Searchable catalogue",
        "what": "cards with kicker, summary, state; text filter and select filters; visible count; truthful empty state",
        "href": "#catalogue",
        "state": "built",
        "tone": "now"
      },
      {
        "label": "12 · Related work",
        "what": "next reading, typed; never filler",
        "href": "#related",
        "state": "built",
        "tone": "now"
      },
      {
        "label": "+ · Atoms the parts share",
        "what": "chips · metrics · words · timeline · section head",
        "href": "#atoms",
        "state": "built",
        "tone": "now"
      }
    ]
  },
  "parts": [
    {
      "id": "shell",
      "n": "01",
      "title": "Global shell",
      "what": "the CRM GroupedRail: grouped navigation, search, collapse; the rail on this page",
      "file": "../shell.mjs · shell/rail.{css,js}",
      "robbed": "SISOCRM GroupedRail (copied, not adapted)",
      "sample": null
    },
    {
      "id": "heading",
      "n": "02",
      "title": "Heading",
      "what": "breadcrumb · kicker · title · purpose · state badges · status panel",
      "file": "heading.html",
      "robbed": "AM hero + status panel (system-map/part-page.css:8-15)",
      "sample": {
        "breadcrumb": [
          {
            "label": "Works",
            "href": "#"
          },
          {
            "label": "siso-foundry"
          }
        ],
        "kicker": "Work <span class=\"sep\">·</span> knowledge_system <span class=\"sep\">·</span> <span class=\"dim\">active</span>",
        "title": "Foundry · industries, valuation, landscape watch",
        "subtitle": "Industry research and value inputs for every SISO offer; 17 industry records, a law-firm pilot live.",
        "badges": [
          {
            "label": "public repo",
            "tone": "now",
            "dot": true
          },
          {
            "label": "section Research",
            "tone": "research"
          },
          {
            "label": "V40 a9ffd16",
            "tone": "muted"
          }
        ],
        "status": {
          "kicker": "Current posture",
          "value": "active · 7 modules",
          "note": "Observed 6 Sep 13:42 from catalog.json.",
          "facts": [
            {
              "k": "owner",
              "v": "FOUNDRY-ZERO"
            },
            {
              "k": "last",
              "v": "6 Sep 13:42"
            }
          ]
        }
      }
    },
    {
      "id": "reasoning",
      "n": "03",
      "title": "Reasoning block",
      "what": "his words (source) vs the seat's reading, then the claim ceiling, data, privacy, empty state, agent entry",
      "file": "reasoning.html",
      "robbed": "AM research reader CLAIM CEILING · system-map evidence ladder",
      "sample": {
        "source": [
          {
            "text": "we also need to put reasoning in each of these templates because like right now it's quite simple",
            "who": "Shaan",
            "at": "6 Sep 18:19"
          }
        ],
        "why": "A page without its reasoning is a layout. The block keeps what he said apart from what the seat read into it.",
        "readers": "Human: judge the reading against the words. Agent: the claim ceiling is the contract.",
        "questions": [
          "Why does this page exist?",
          "What may it claim?"
        ],
        "claim_ceiling": "Only what the record says; authored text is labelled.",
        "data": "plan/templates.json reasoning block.",
        "privacy": "Public.",
        "empty_state": "No source → the source column says so.",
        "agent_entry": "templates/<id>/README.md"
      }
    },
    {
      "id": "map",
      "n": "04",
      "title": "Map · typed relationship map + ecosystem loop",
      "what": "the mind map: repos, Works, questions, industries, people, nodes as a graph, with its text equivalent; and the loop",
      "file": "map.html · loop.html",
      "robbed": "AM dependency link chips (system-map/index.html:152-157); loop from library-ui-spec §6",
      "sample": {
        "centre": {
          "label": "Great Library",
          "href": "#"
        },
        "types": [
          {
            "type": "repo",
            "label": "Repos",
            "tone": "projects",
            "items": [
              {